campaign_id,url,title,subtitle,overview_text,details_text,required_amount_raw,paid_amount_raw,left_amount_raw,required_amount,paid_amount,left_amount,donations_count,comments_count,updates_count,shares_count,image_url,year_detected,year_source,date_status,scraped_at
745,https://molhamteam.com/en/campaigns/745,Ten days of Dhul-Hijjah,,"The best and greatest days of the year have arrived...
the most beloved to Allah (SWT). Don’t let them pass without taking full advantage of them!
How can you take advantage of them?
By reviving the Sunnah of Allah (SWT), dedicating a portion of your charity to those in need, and supporting our struggling families.
""Zakat and Charity - The Ten Days of Dhul-Hijjah""
campaign to ensure your Zakat and charity reach those in need in
Simply click the donation button
and choose how you wish to donate:
throughout these blessed days, allowing a daily deduction from your account automatically until the end of the ten days of Dhul-Hijjah.
Be a support to our families in Syria during these days that won’t come again.","<p><strong>The best and greatest days of the year have arrived...</strong> the most beloved to Allah (SWT). Don’t let them pass without taking full advantage of them!</p> <p><strong>How can you take advantage of them?</strong></p> <p>By reviving the Sunnah of Allah (SWT), dedicating a portion of your charity to those in need, and supporting our struggling families.</p> <hr> <p>We’ve launched the <strong>""Zakat and Charity - The Ten Days of Dhul-Hijjah""</strong> campaign to ensure your Zakat and charity reach those in need in <strong>Syria</strong> during these blessed days.</p> <p><strong>Simply click the donation button</strong> and choose how you wish to donate:</p> <ul> <li>Zakat</li> <li>Charity</li> <li>Sacrifice</li> </ul> <p>You can also select <strong>""Repeat donation daily""</strong> throughout these blessed days, allowing a daily deduction from your account automatically until the end of the ten days of Dhul-Hijjah.</p> <p><strong>Be a support to our families in Syria during these days that won’t come again.</strong></p>",125000,123835,1165,125000,123835,1165,2193,0,0,8,https://cdn.molhamteam.com/i/jG0MuDtT8D4YUIxQjvt7_thumb_1:1.jpg,2025,publishing_date,certain,2026-04-22T09:27:38.877425+00:00
746,https://molhamteam.com/en/campaigns/746,A sacrifice for your orphan child!,,"A sacrifice for your orphan child!
Udhiyah (sacrifice) is a Sunnah that brings reward, and an act of kindness that relieves the hardship of the oppressed—those who have endured the suffering of injustice and displacement. Today, after years of forced displacement and separation, we relaunch the Eid Sacrifice Campaign, this time focusing on our orphaned children. One-third of each sacrifice will go to the sponsored orphan's family, while the remaining two-thirds will be distributed to families of orphans, widows, and displaced people in the region. Sheep (55–60 kg): $330 – includes slaughtering and cutting Whole cow (500–550 kg): $2,500 – includes slaughtering and cutting","Udhiyah (sacrifice) is a Sunnah that brings reward, and an act of kindness that relieves the hardship of the oppressed—those who have endured the suffering of injustice and displacement. Today, after years of forced displacement and separation, we relaunch the Eid Sacrifice Campaign, this time focusing on our orphaned children. One-third of each sacrifice will go to the sponsored orphan's family, while the remaining two-thirds will be distributed to families of orphans, widows, and displaced people in the region. Sheep (55–60 kg): $330 – includes slaughtering and cutting Whole cow (500–550 kg): $2,500 – includes slaughtering and cutting",50000,15595,34405,50000,15595,34405,58,0,0,0,https://cdn.molhamteam.com/i/Ov3MclibX872Yx1rNHTX_thumb_1:1.jpg,2025,publishing_date,certain,2026-04-22T09:27:38.895172+00:00
747,https://molhamteam.com/en/campaigns/747,Eid clothing for orphaned children,,"Eid clothing for orphaned children
Do you know where the joy of Eid lies? It's in the little details — in the smile of a young girl showing off her new dress, in the dance of a boy counting his Eid money, and in the pictures of children wearing their new clothes. And because happiness is a right for everyone, you can bring joy to the heart of an orphaned child by providing them with Eid clothing for just $40.","Do you know where the joy of Eid lies? It's in the little details — in the smile of a young girl showing off her new dress, in the dance of a boy counting his Eid money, and in the pictures of children wearing their new clothes. And because happiness is a right for everyone, you can bring joy to the heart of an orphaned child by providing them with Eid clothing for just $40.",50000,31768,18232,50000,31768,18232,375,0,0,2,https://cdn.molhamteam.com/i/vH5Xv40fpZcyGzh5V8wl_thumb_1:1.jpg,2025,publishing_date,certain,2026-04-22T09:27:38.913135+00:00
748,https://molhamteam.com/en/campaigns/748,Eid Toys !,,"This campaign is dedicated to bringing smiles to children's faces during Eid. On Eid al-Fitr, we must remember that a child's joy isn't complete without an Eid toy! 🎁 Donate a gift to a child this Eid!",,8000,4732,3268,8000,4732,3268,199,0,1,1,https://cdn.molhamteam.com/i/qLTm31wORJWzUi5YvTds_thumb_1:1.jpg,2025,publishing_date,certain,2026-04-22T09:27:38.932742+00:00
749,https://molhamteam.com/en/campaigns/749,Eid Clothes and Eid Gifts,,"Eid Clothes and Eid Gifts
Eid is the joy of a displaced child with new clothes and the eagerly awaited Eid gift... Ensuring that Eid doesn't pass by them like any other day... The ""Eid Gifts"" campaign aims to make a difference for the children, granting them joy and bringing happiness directly from your hearts to theirs! Eid clothes and gifts will be provided to hundreds of children in northern Syria, refugee countries, and Gaza, drawing smiles on faces that have been stolen by war... By donating $40, you can secure Eid clothes for one child, or give an Eid gift to a child for $3. Many smiles and joys await you to create...","Eid is the joy of a displaced child with new clothes and the eagerly awaited Eid gift... Ensuring that Eid doesn't pass by them like any other day... The ""Eid Gifts"" campaign aims to make a difference for the children, granting them joy and bringing happiness directly from your hearts to theirs! Eid clothes and gifts will be provided to hundreds of children in northern Syria, refugee countries, and Gaza, drawing smiles on faces that have been stolen by war... By donating $40, you can secure Eid clothes for one child, or give an Eid gift to a child for $3. Many smiles and joys await you to create...",50000,63914,-13914,50000,63914,-13914,840,0,4,10,https://cdn.molhamteam.com/i/eW8s1z5o1zVwn7oEIcXE_thumb_1:1.jpg,2025,publishing_date,certain,2026-04-22T09:27:38.952331+00:00
751,https://molhamteam.com/en/campaigns/751,Paying off the debts,,"Debt — its shackles are suffocating thousands of families in Syria, families who were forced by displacement and the harshness of life to rely on borrowing as a last resort to feed their children and secure basic necessities. Today, as the country begins to heal and the jailer's grip is broken, it is time for us to extend our hands as well — to help free those imprisoned due to mounting debts. Your donations can free a prisoner and reunite a missing loved one with their family. In doing so, you not only return a cherished member to their home, but also offer the entire family a renewed chance at a better life.",,50000,22856,27144,50000,22856,27144,610,0,0,0,https://cdn.molhamteam.com/i/JDi6cpJIoU3xWkLakJCY_thumb_1:1.jpg,2025,publishing_date,certain,2026-04-22T09:27:38.971290+00:00
752,https://molhamteam.com/en/campaigns/752,Beat The Heat Campaign !,,"Beat The Heat Campaign !
Fans, coolers, juices, initiatives, and even activities to ease the summer heat...
All are part of the ""Shoob"" campaign.
For the summer of 2025, this campaign launches to relieve displaced families living in tents and those who have recently returned to their homes, through refreshing water-based activities that bring joy to their little hearts.
that brings happiness and healing to hearts across camps and cities in Syria. You never know which sincere prayer might be meant for you!
Your donation is what helps this campaign reach as many families as possible
—making their summer less scorching.
A 20-liter water cooler that keeps water cold and meets daily needs –
A 165-watt solar panel to power their basic needs –
A 60-amp battery to provide a simple electricity source –
A fan to ease the harsh summer heat –
An ice block to refresh their day in the heat –","<p><strong>Fans, coolers, juices, initiatives, and even activities to ease the summer heat...</strong> All are part of the ""Shoob"" campaign.</p> <p>For the summer of 2025, this campaign launches to relieve displaced families living in tents and those who have recently returned to their homes, through refreshing water-based activities that bring joy to their little hearts.</p> <p><strong>Contribute to this campaign</strong> that brings happiness and healing to hearts across camps and cities in Syria. You never know which sincere prayer might be meant for you!</p> <p><strong>Your donation is what helps this campaign reach as many families as possible</strong>—making their summer less scorching.</p> <br> <p><strong>How you can contribute:</strong></p> <ul> <li>A 20-liter water cooler that keeps water cold and meets daily needs – <strong>for $15</strong>.</li> <li>A 165-watt solar panel to power their basic needs – <strong>for $75</strong>.</li> <li>A 60-amp battery to provide a simple electricity source – <strong>for $45</strong>.</li> <li>A fan to ease the harsh summer heat – <strong>for $25</strong>.</li> <li>An ice block to refresh their day in the heat – <strong>for only $2</strong>.</li> </ul>",50000,12148,37852,50000,12148,37852,199,0,10,1,https://cdn.molhamteam.com/i/622RPFqw1BJ7gmh2jJ8r_thumb_1:1.jpg,2025,publishing_date,certain,2026-04-22T09:27:38.993305+00:00
753,https://molhamteam.com/en/campaigns/753,Life Campaign !,,"Severe malnutrition and extreme dehydration have accompanied our little Suleiman since his premature birth. He was taken from his mother’s embrace, and the narrow space of the incubator became his entire world. Suleiman is in urgent need of treatment and medical tests, in addition to essential medical supplies—costs that his father, who struggles while suffering from a severe disc injury, and his mother, who endures exhausting seizure episodes, simply cannot afford. This Friday, an amount of $200 could be the warmth that brings him back to his mother’s arms, and returns to him a childhood free of pain.",,60000,57854,2146,60000,57854,2146,1568,1,4,8,https://cdn.molhamteam.com/i/8QVGliN3UVm94bEGDLpI_thumb_1:1.jpg,2025,publishing_date,certain,2026-04-22T09:27:39.013228+00:00
754,https://molhamteam.com/en/campaigns/754,Emergency Appeal: A Burned Camp !,,"Emergency Appeal: A Burned Camp !
While we live in safety under roofs that shield us from the heat and cold, far away in
, a fire consumed two tents — the only shelter for two Syrian refugee families.
The tent wasn’t just fabric. It was a warm embrace for a mother feeding her children, a shield for a father fighting to survive, and a roof over the dreams of children who know their homeland only through memories.
In an instant, that fragile safety turned to ashes.
Clothes burned. Toys melted. Dreams suffocated in merciless flames.
Everyone survived — but they emerged barefoot, hungry, and stunned… with nothing left.
Today, we call upon you — not for charity, but to awaken your humanity.
We are not just collecting money. We are gathering
In the hands of mercy, even the smallest gift can
extinguish flames, revive a heart, and restore life
to these families and others like them.","<p>While we live in safety under roofs that shield us from the heat and cold, far away in <strong>Khirbet al-Joz</strong>, a fire consumed two tents — the only shelter for two Syrian refugee families.</p> <p>The tent wasn’t just fabric. It was a warm embrace for a mother feeding her children, a shield for a father fighting to survive, and a roof over the dreams of children who know their homeland only through memories.</p> <p>In an instant, that fragile safety turned to ashes. <strong>Clothes burned. Toys melted. Dreams suffocated in merciless flames.</strong></p> <p>Everyone survived — but they emerged barefoot, hungry, and stunned… with nothing left.</p> <p><strong>Today, we call upon you — not for charity, but to awaken your humanity.</strong></p> <p>We are not just collecting money. We are gathering <strong>warmth, dignity, and safety</strong>.</p> <p><em>Donate whatever you can — even a little.</em> In the hands of mercy, even the smallest gift can <strong>extinguish flames, revive a heart, and restore life</strong> to these families and others like them.</p>",50000,4162,45838,50000,4162,45838,120,0,1,1,https://cdn.molhamteam.com/i/80k1rtww2nAMH0shhy1H_thumb_1:1.jpg,2025,publishing_date,certain,2026-04-22T09:27:39.032264+00:00
755,https://molhamteam.com/en/campaigns/755,Urgent Humanitarian Cases !,,"A girl suffered extensive burns on her face and limbs❗ Alaa, a sweet young girl and a beloved princess for a family that has endured numerous struggles in recent years, from displacement to bombing, ultimately ended up in a tent that offers no protection from severe weather. Months back, Alaa was trapped in a fire caused by a heater explosion in their tent. Alaa harmed her arms and face and has been enduring persistent pain as her family struggles to obtain her medical care. The hot weather and poor living conditions have further complicated her condition. Her father continually battles to obtain the money Alaa needs for her treatment. With your help, we can alleviate Alaa’s pain. Don’t hesitate to provide a helping hand.",,50000,33391,16609,50000,33391,16609,758,0,2,2,https://cdn.molhamteam.com/i/MqIY0rzFPzNEJC1WK7A6_thumb_1:1.jpg,2025,publishing_date,certain,2026-04-22T09:27:39.052019+00:00
756,https://molhamteam.com/en/campaigns/756,Bring Them Home !,,"""We’ve been away from home for years… We miss the shade of our walls, the call to prayer from our village’s minaret, the smell of bread from the neighborhood oven, and the warmth of family and neighbors gathered around one table… We miss life itself."" Their hearts hold a thousand stories of home, and their eyes burn with an unquenchable longing. Our people didn’t choose to leave, nor were they refugees by choice. It was the bombing, the arrests, and the desperate search for safety that tore them from their homes and left their days folded between tents, camps, and an endless ache. But today, return is becoming a reality—a dignified return, without fear, without bombings, without yet another displacement. The “Together, Back Home” campaign is a promise of return—a real step toward bringing our people back to their homes after years of exile and suffering. With your support, we can secure transportation costs and cover the journey home… Every contribution is a key to a home that’s been locked for years.",,50000,12711,37289,50000,12711,37289,62,0,1,2,https://cdn.molhamteam.com/i/MrshUcG0KlVYSfj2ilgP_thumb_1:1.jpg,2025,publishing_date,certain,2026-04-22T09:27:39.070418+00:00
757,https://molhamteam.com/en/campaigns/757,"One Pulse, One Heart",,"In the summer of 2025, a large volunteer medical delegation—featuring doctors and surgeons from around the world—will reach thousands of patients in Syria who have been waiting for months, or even years, for a chance at life-saving treatment or surgery. This humanitarian mission is organized by the Syrian-German Medical Association (SGMA) in collaboration with Molham Volunteering Team, and will target wide regions and several provinces. The goal is to perform hundreds of free surgeries, including cardiac, neurological, orthopedic, gynecological, maxillofacial procedures, and many more. Specialized medical consultations and examinations will also be provided. In addition, the campaign aims to train local healthcare staff, enhance medical capacities, and launch health awareness initiatives. This heartbeat cannot continue without your support. At Molham Team, we launch the campaign “Our Pulse is One” driven by our shared responsibility and the belief that even if you can’t be in the operating room, you can be the reason it opens 💙 Join us and donate to the campaign.",,100000,43319,56681,100000,43319,56681,498,1,6,6,https://cdn.molhamteam.com/i/g96vNqoWYC8llbKtLuBa_thumb_1:1.jpg,2025,publishing_date,certain,2026-04-22T09:27:39.090712+00:00
758,https://molhamteam.com/en/campaigns/758,Wildfires - Emergency Response !,,"Wildfires - Emergency Response !
, livelihoods are surrounded by flames, and forests — once a breath of fresh air for the people — are turning to ash.
Wildfires in the coastal region
continue to spread, triggering explosions from remnants of war. Meanwhile, civil defense teams are racing against time to contain and extinguish the fires — but the situation is growing increasingly difficult.
Today, we need to stand with them
in every possible way, providing the essential support and equipment they urgently need.
Join us in supporting the firefighting and rescue teams — and help save our green lands.","<p><strong>Homes are under threat</strong>, livelihoods are surrounded by flames, and forests — once a breath of fresh air for the people — are turning to ash.</p> <p><strong>Wildfires in the coastal region</strong> continue to spread, triggering explosions from remnants of war. Meanwhile, civil defense teams are racing against time to contain and extinguish the fires — but the situation is growing increasingly difficult.</p> <p><strong>Today, we need to stand with them</strong> in every possible way, providing the essential support and equipment they urgently need.</p> <p><em>Join us in supporting the firefighting and rescue teams — and help save our green lands.</em></p>",75000,68690,6310,75000,68690,6310,1955,2,3,40,https://cdn.molhamteam.com/i/onDPDS21Su2qRv4ojuMG_thumb_1:1.jpg,2025,publishing_date,certain,2026-04-22T09:27:39.110743+00:00
759,https://molhamteam.com/en/campaigns/759,Lungs of Syria !,,"Wildfires have stolen the soul of the country, its crops... and its green face!
Hundreds of thousands of forest trees across
— have turned to ash.
In response to the scale of this disaster, we are launching the
campaign today to reforest our free homeland and restore its green lifeline.
Every tree planted is a new heartbeat of hope.
Join us by donating just
Every tree you plant today breathes new life into this land.
Help us revive our forests and bring back the lungs of Syria.","<p><strong>Wildfires have stolen the soul of the country, its crops... and its green face!</strong></p> <p>Hundreds of thousands of forest trees across <strong>28 locations</strong> — covering <strong>10,000 hectares</strong> — have turned to ash.</p> <p>In response to the scale of this disaster, we are launching the <strong>""Lungs of Syria""</strong> campaign today to reforest our free homeland and restore its green lifeline.</p> <p><strong>Every tree planted is a new heartbeat of hope.</strong><br> Join us by donating just <strong>$10</strong> <p><strong>Every tree you plant today breathes new life into this land.</strong><br> Help us revive our forests and bring back the lungs of Syria.</p>",100000,22988,77012,100000,22988,77012,742,2,0,19,https://cdn.molhamteam.com/i/rctcrLZcXXcy5k4FToG0_thumb_1:1.jpg,2025,publishing_date,certain,2026-04-22T09:27:39.130753+00:00
761,https://molhamteam.com/en/campaigns/761,Emergency response - Displaced families arriving in Daraa,,"Emergency response - Displaced families arriving in Daraa
Ismail... A Child Burned Amid Darkness and Displacement
, 3-year-old Ismail suffered painful burns to his face and hand after falling onto a pot of boiling milk just moments before his family was forced to flee.
With nothing but the clothes on their backs, the family escaped, leaving behind their home and everything they owned. Today, they are staying in a shelter in the
area, with no permanent home or clear future.
Like many displaced families, they are facing severe shortages of basic necessities and are in desperate need of food, clothing, healthcare, and psychological support in the face of harsh and prolonged displacement.
Your donation — no matter the amount — can help us save hundreds of families in shelters by providing them with the food and clothing they urgently need.","<h2>Ismail... A Child Burned Amid Darkness and Displacement</h2> <p>In <strong>Karam Al-Zaytoun – Sweida</strong>, 3-year-old Ismail suffered painful burns to his face and hand after falling onto a pot of boiling milk just moments before his family was forced to flee.</p> <p>With nothing but the clothes on their backs, the family escaped, leaving behind their home and everything they owned. Today, they are staying in a shelter in the <strong>Sayyida Zainab</strong> area, with no permanent home or clear future.</p> <p>Like many displaced families, they are facing severe shortages of basic necessities and are in desperate need of food, clothing, healthcare, and psychological support in the face of harsh and prolonged displacement.</p> <p><strong>Your donation — no matter the amount — can help us save hundreds of families in shelters by providing them with the food and clothing they urgently need.</strong></p>",50000,12637,37363,50000,12637,37363,298,0,4,1,https://cdn.molhamteam.com/i/KHAHYBGsELagQdjshVm3_thumb_1:1.jpg,2025,publishing_date,certain,2026-04-22T09:27:39.150118+00:00
762,https://molhamteam.com/en/campaigns/762,Molham Academy,,"Molham Academy is an endowment project, and your support can make it go on.
You don't have to enroll in the courses to contribute to our mission.
You can support the Academy itself: an endowment educational platform, whose proceeds go entirely to support educational projects inside Syria.
Your donation today helps us cover the academy's operational costs and provide professional educational content to those who truly need it.","<p>Molham Academy is an endowment project, and your support can make it go on.</p> <p>You don't have to enroll in the courses to contribute to our mission.<br>You can support the Academy itself: an endowment educational platform, whose proceeds go entirely to support educational projects inside Syria.</p> <p>Your donation today helps us cover the academy's operational costs and provide professional educational content to those who truly need it.</p> <p>Donate to the academy to remain a platform for knowledge and a tool for building the future.</p>",50000,0,50000,50000,0,50000,0,0,0,0,https://cdn.molhamteam.com/i/Cm8D8eIy6woCCwuMuFw5_thumb_1:1.jpg,2025,publishing_date,certain,2026-04-22T09:27:39.169719+00:00
763,https://molhamteam.com/en/campaigns/763,Urgent Medical Cases !,,"A child whose tiny breaths are surrounded by danger 💔 “Sulaiman” was born prematurely, and his suffering began with pain. Our little one is facing severe malnutrition and extreme dehydration, which took him away from his mother’s arms and made the incubator his new home. His family is going through extremely difficult conditions, and Sulaiman desperately needs medication, treatment, and costly medical tests, in addition to medical supplies that his family is unable to afford. Help bring Sulaiman and other children waiting for you back to their parents’ embrace. Donate to be their lifeline.",,140000,140556,-556,140000,140556,-556,1632,3,0,5,https://cdn.molhamteam.com/i/RUMGKhNi3ImtVMs2zC7R_thumb_1:1.jpg,2025,publishing_date,certain,2026-04-22T09:27:39.189177+00:00
