campaign_id,url,title,subtitle,overview_text,details_text,required_amount_raw,paid_amount_raw,left_amount_raw,required_amount,paid_amount,left_amount,donations_count,comments_count,updates_count,shares_count,image_url,year_detected,year_source,date_status,scraped_at
288,https://molhamteam.com/en/campaigns/288,Urgent Cases Fund,,"He has eye cancer. Every time it comes to my mind, I break down in tears. My baby is the joy that turned into tragedy. I can't tolerate seeing him crying because of pains. Khalil, a 6 months newborn who is awaiting your help with 1500$ to get the treatment. This Urgent Cases Fund is aimed at providing treatment for Khalil and many similar medical cases that require immediate help. Your donation saves lives!",,242906,242906,0,242906,242906,0,4165,0,43,0,https://cdn.molhamteam.com/i/h0hfK7FdrpNr80Ekjp3f_thumb_1:1.jpg,2021,publishing_date,certain,2026-04-22T09:27:30.685487+00:00
289,https://molhamteam.com/en/campaigns/289,Humanitarian Cases,,"Reem is 4 months newborn who got dehydration, intestinal obstruction, and COVID-19. Her father is a displaced man who has cancer. Reem needs baby milk and medical essentials cost $250. Your donations will help Reem and hundreds of similar cases.",,89290,89297,-7,89290,89297,-7,3509,0,18,1,https://cdn.molhamteam.com/i/GDDBZwBf4Fyc4s2DcSZa_thumb_1:1.jpg,2021,publishing_date,certain,2026-04-22T09:27:30.707389+00:00
290,https://molhamteam.com/en/campaigns/290,Talents Support Fund,,"In the past 10 years, an entire generation was born in war conditions; children stripped of their most basic rights. Besides education, they were deprived of all kinds of support for their talents in sports, literature, and art, which is necessary to allow these talents to nurture. We believe that these talents are as important as education in children's character development. This is why we launch a campaign dedicated towards nurturing the talents of deprived and vulnerable children and youth who live in IDP camps and in neighbouring countries. Each donation you make contributes in building a strong generation with a bright future.",,3257,3257,0,3257,3257,0,32,0,9,0,https://cdn.molhamteam.com/i/fatQKPgydzAly4ZPmv7X_thumb_1:1.jpg,2021,publishing_date,certain,2026-04-22T09:27:30.728349+00:00
291,https://molhamteam.com/en/campaigns/291,Humanitarian Sponsorship Fund,,"“Our father died in front of our eyes because of an aerial attack. We have no one to take care of us. My siblings Mustafa & Aya have a genetic disease, and can only move their eyes.” Martyrdom, displacement and rare diseases are the daily miserable reality that these 8 orphans go through. They lost their father and await your support through monthly sponsorship of $100. The Humanitarian Sponsorship Fund is dedicated towards providing long-term sponsorship for this family and similar ones.",,47306,47306,0,47306,47306,0,577,0,1,0,https://cdn.molhamteam.com/i/QEjE00mVZBh97JFfC6GP_thumb_1:1.jpg,2021,publishing_date,certain,2026-04-22T09:27:30.748171+00:00
292,https://molhamteam.com/en/campaigns/292,With Turkey,,"In solidarity with the Turkish people who are facing devastating wildfires that hit large parts of Turkey, Molham Team launches an emergency campaign to help those who were impacted from it with basic needs and to contribute in the reforestation and rehabilitation of homes.",,2397,2397,0,2397,2397,0,71,0,0,0,https://cdn.molhamteam.com/i/ngTPDXeZMqvlh39ZNucN_thumb_1:1.jpg,2021,publishing_date,certain,2026-04-22T09:27:30.767671+00:00
293,https://molhamteam.com/en/campaigns/293,Housing Units 3,,Today will begin the fundraising campaign for the fifth housing project in Molham Team. Your donations will change many displaced families' live by providing safe houses for them to settle in. Your support with a one dollar donation will contribute in making a lifelong impact for a displaced family. The cost of one share in a house is $250. The total cost of one concrete block house ready for a family to move in is $2500.,,116301,116301,0,116301,116301,0,665,0,7,0,https://cdn.molhamteam.com/i/WkrK4B9sL4RfwwXikVFh_thumb_1:1.jpg,2021,publishing_date,certain,2026-04-22T09:27:30.787288+00:00
294,https://molhamteam.com/en/campaigns/294,Help me help others,,"""English below"" ----------------------------------------------------------------------------- Zaterdag 4 September 2021 organiseren wij een fietstocht voor onderwijs van Syrische kinderen. We gaan 99km fietsen: wij starten in Brussel om vervolgens, via Louvain-la-Neuve en Nivelles, in Mons te eindigen. Om een betere wereld te krijgen, willen wij graag onze aandacht geven en onszelf inzetten voor de toekomst van Syrische kinderen. Wij zouden graag hebben dat jullie daarin mee deelnemen. Syrische kinderen hebben boeken nodig, ze hebben vreedzame boeken nodig, want ze hebben genoeg bloederige verhalen gelezen. Deze keer fiets ik samen met Mohamed Idelbi en Omar Shaikhani. Uw sponsoring is zeer belangrijk en is een vrijwillige bijdrage. Elke cent kan een wereld van verschil maken voor een kind. Deel dit via Facebook, Instagram, Twitter of e-mail. ------------------------------------------------------------------------------------------------------------------------------------------------------------------------------------ On September 4th, 2021, we are organizing a bicycle tour to support Syrian children’s education. The tour will be 99km, from Brussels to Mons, passing through Louvain-la-Neuve and Nivelles. In order to build a better world, we would like to offer the best future we can to Syrian children by giving them our attention and commitment. We would love for you to participate! The Syrian children need books, beautiful and peaceful books, because they have already known enough violence. This time, I will be cycling alongside Mohamed Idelbi and Omar Shaikhani. Your sponsorship means a lot to us, and the amount is voluntary. Each cent can make a world of difference for a child. Don’t hesitate to share this on Facebook, Instagram, Twitter or e-mail.",,2486,2486,0,2486,2486,0,73,0,4,0,https://cdn.molhamteam.com/i/fw2naptVWJDIyzu4Xbt0_thumb_1:1.jpg,2021,publishing_date,certain,2026-04-22T09:27:30.808981+00:00
295,https://molhamteam.com/en/campaigns/295,A mosque and educational institute in Mersin,,"A mosque and educational institute in Mersin
Fahd Raie has launched a campaign to secure a building to be an endowment ( waqf) for students of religious sciences in Mersin. The institute will involve more than 1000 students to learn Alqura'an, Fiqh, and religious fundamentals in addition to a mosque for Fridays. We call everyone who would like to have sadaqa jariyah to donate for the endowment. The endowment costs 3 million Turkish Lira, one million is already collected.","Fahd Raie has launched a campaign to secure a building to be an endowment ( waqf) for students of religious sciences in Mersin. The institute will involve more than 1000 students to learn Alqura'an, Fiqh, and religious fundamentals in addition to a mosque for Fridays. We call everyone who would like to have sadaqa jariyah to donate for the endowment. The endowment costs 3 million Turkish Lira, one million is already collected.",10207,10207,0,10207,10207,0,210,0,0,0,https://cdn.molhamteam.com/i/hPqShdzojWAdpEC0XDLr_thumb_1:1.jpg,2021,publishing_date,certain,2026-04-22T09:27:30.829081+00:00
296,https://molhamteam.com/en/campaigns/296,Back to School Stationery2,,"Due to the economic crisis that people endure in Syria and in neighboring countries, many children are deprived of education. As the scholar year is so close, Molham team launched this campaign to offer scholar stationery for students in Syria and in refugee countries, in addition to the class desks, boards, and other essentials for schools in camps.",,73367,73367,0,73367,73367,0,889,0,7,0,https://cdn.molhamteam.com/i/i3K6mbIqRCxwBIExCRaI_thumb_1:1.jpg,2021,publishing_date,certain,2026-04-22T09:27:30.849129+00:00
297,https://molhamteam.com/en/campaigns/297,Give What You Love,,"Allah said in the holy Quran, '' By no means shall you attain to righteousness until you spend (benevolently) out of what you love; and whatever thing you spend, Allah surely knows it.'' Ali ‘Imran 92. This campaign is dedicated towards helping the most vulnerable displaced families. Give any amount you can and lessen their burdens.",,15962,15962,0,15962,15962,0,472,0,3,2,https://cdn.molhamteam.com/i/YLVZawBmjHav496tqoLr_thumb_1:1.jpg,2021,publishing_date,certain,2026-04-22T09:27:30.868122+00:00
298,https://molhamteam.com/en/campaigns/298,Medical Sponsosrships,,''None of the doctors have given us any hope of recovery for his condition.'' One of the most painful dermatological diseases is pemphigus where the child suffers pains with every movement. Saif Aldeen was born with all these intolerable pains in addition to his desperation of being able to play and move like other children. Many medical essentials of gauzes and antiseptics are basic in the management of his case. Your support of $75 every month will ameliorate his pains. This campaign aims at helping Saif Aldeen and similar cases.,,30134,30134,0,30134,30134,0,847,0,2,0,https://cdn.molhamteam.com/i/ZSLPY8z5s8nLXrLWmAw7_thumb_1:1.jpg,2021,publishing_date,certain,2026-04-22T09:27:30.887008+00:00
299,https://molhamteam.com/en/campaigns/299,Urgent Humanitarian Cases,,"""My baby had a cardiac arrest while she was under surgery! Since we arrived Turkey, my only daughter has been in the ICU with a peacemaker. I have no means to rescue her, also I have no idea how my family is doing back there in Syria alone in the tent..'' These are the words of Asma'a father. The one-year-old baby was born with hydrocephalus and cardiac congenital defect. Her father carries heavy burdens and a donation of $400 would alleviate some of them. Through this campaign, we aim to offer support for Asma'a and similar cases in urgent need of help.",,51592,51592,0,51592,51592,0,843,0,0,1,https://cdn.molhamteam.com/i/HjloVhnkK7aCY7hMx3JZ_thumb_1:1.jpg,2021,publishing_date,certain,2026-04-22T09:27:30.905612+00:00
300,https://molhamteam.com/en/campaigns/300,Joud's Dream,,"On September 7, 2021, a Syrian regime's missile fragment hit Joud Shreet in her heart and killed her dream at 21 years of age, just one week after finishing her BA in Psychology. Joud’s dream was born one year ago when she decided to open up a K-4 school in Idlib province, Syria. She worked day and night to make the school a reality and to make it one of a kind: Joud created the first nonprofit school to follow a Montessori method and help kids growing up during the war learn while having fun and enjoying a break from their cruel reality. While undertaking college coursework in this cruel reality herself, Joud conceived and created her school from scratch. It became an immediate success, prompting her to flip an admin space into an extra classroom for additional interested students. Joud Shreet meaningfully impacted 140 children through her school, children who carry forth her vision toward a better future for Syrian children. This fundraiser intends to keep Joud’s dream alive and expand her impact on the children who need it most. Please help us make it a possibility!",,24831,25331,-500,24831,25331,-500,438,0,0,0,https://cdn.molhamteam.com/i/eJOt3cvSqr2aK17mxthM_thumb_1:1.jpg,2021,publishing_date,certain,2026-04-22T09:27:30.925189+00:00
301,https://molhamteam.com/en/campaigns/301,Molham Scholarship,,"''Being born with no arms never impeded me. I chased my hope since birth to pursue my studies. I got the high school certificate despite all the terrific conditions of displacement and being away from my family living in the tent. Completing my degree, graduation, and starting my career is my only dream for now.'' Nahla is a university student whose dream of changing her family's life wouldn't be true unless you supported her. Donate the campaign of Molham Scholarship, and your sponsorship is her only hope for that. You may donate from your Zakat or as Sadaqah Jariyah (ongoing charity) to help these students move on with their lives and transform the reality of their families.",,157241,157241,0,157241,157241,0,443,0,2,1,https://cdn.molhamteam.com/i/PLjeu73qMdeeVQ4pWwYu_thumb_1:1.jpg,2021,publishing_date,certain,2026-04-22T09:27:30.943699+00:00
302,https://molhamteam.com/en/campaigns/302,A Breath - COVID19 Emergency Response,,"A Breath - COVID19 Emergency Response
NW Syria is facing a wave of COVID-19 delta variant infections at an alarming rate, accompanied by a high mortality rate. Meanwhile, the healthcare system is unable to cope amidst the scarcity of life-saving and preventative medical supplies. In other words, the healthcare system is on the brink of collapse! This necessitates a large-scale, prompt response by the community. Therefore, and in collaboration with the Civil Defence, Violet organization, and several doctors and journalists, we launched the campaign of ''A Breath''. Within the first phase of this campaign, we aim at securing 1000 oxygen cylinders. Your donation will rescue a breathless patient with no means to face the deadly virus.","NW Syria is facing a wave of COVID-19 delta variant infections at an alarming rate, accompanied by a high mortality rate. Meanwhile, the healthcare system is unable to cope amidst the scarcity of life-saving and preventative medical supplies. In other words, the healthcare system is on the brink of collapse! This necessitates a large-scale, prompt response by the community. Therefore, and in collaboration with the Civil Defence, Violet organization, and several doctors and journalists, we launched the campaign of ''A Breath''. Within the first phase of this campaign, we aim at securing 1000 oxygen cylinders. Your donation will rescue a breathless patient with no means to face the deadly virus.",26994,26994,0,26994,26994,0,760,0,24,0,https://cdn.molhamteam.com/i/lBGAT5g4qfXhE9wpTFPd_thumb_1:1.jpg,2021,publishing_date,certain,2026-04-22T09:27:30.963070+00:00
303,https://molhamteam.com/en/campaigns/303,Urgent Cases Fund,,"Nayef is a displaced man who lives in a camp. His only wish is to speak, as he lost his larynx due to cancer! The man is devastated and needs $650 to secure a medical device that will help him regain his ability to talk. This Urgent Cases Fund is aimed at providing treatment for Abdulrazzak and many similar medical cases that require immediate help. Your donation saves lives!",,129846,129846,0,129846,129846,0,3574,0,37,0,https://cdn.molhamteam.com/i/rRkLkzlLzRn5M7kX8hYJ_thumb_1:1.jpg,2021,publishing_date,certain,2026-04-22T09:27:30.983834+00:00
304,https://molhamteam.com/en/campaigns/304,Emergency Response for Camps,,"'Our tents collapsed in front of our eyes. Within a moment, 35 people became homeless! Being displaced from our homes left us vulnerable, but no words could describe our devastation from what occurred to us now..' Abu Muhammad is the main provider of eight families, most of whom are widows and orphans. He tried to describe the immense pain he felt when watching his grandchildren sleeping on the street, while he can't protect them from the cold or insects! To ease the helplessness of this family and other families who are experiencing the same conditions, we launched this campaign to respond to their most urgent needs; shelter.",,13475,13475,0,13475,13475,0,385,0,16,0,https://cdn.molhamteam.com/i/2IJJUc2sd4HgXU4PkM7k_thumb_1:1.jpg,2021,publishing_date,certain,2026-04-22T09:27:31.002529+00:00
305,https://molhamteam.com/en/campaigns/305,The Path to Light - Orphans Support Fund,,"The Path to Light - Orphans Support Fund
“I can’t forget the scene of my dad’s body full of blood. I sit alone in a room and cry everyday trying to forget what I have seen but the pain of my loss grows more! After his martyrdom, we were displaced to a tent and I was responsible for securing my family’s needs. This all caused me to be behind in my education as I wasn’t able to focus on it anymore!” Hiba endured huge pain due to her father’s martyrdom because of bombardments. Her mental health condition worsened and started to be very secluded, this caused her to be bullied from the children around her. A monthly sponsorship of $50 can compensate for what Hiba has been through, and guarantee her a brighter future! Hundreds of orphans have stories similar to Heba story, and it is our duty to sponsor them to offer them the chance to live a decent childhood!","“I can’t forget the scene of my dad’s body full of blood. I sit alone in a room and cry everyday trying to forget what I have seen but the pain of my loss grows more! After his martyrdom, we were displaced to a tent and I was responsible for securing my family’s needs. This all caused me to be behind in my education as I wasn’t able to focus on it anymore!” Hiba endured huge pain due to her father’s martyrdom because of bombardments. Her mental health condition worsened and started to be very secluded, this caused her to be bullied from the children around her. A monthly sponsorship of $50 can compensate for what Hiba has been through, and guarantee her a brighter future! Hundreds of orphans have stories similar to Heba story, and it is our duty to sponsor them to offer them the chance to live a decent childhood!",90144,90144,0,90144,90144,0,847,0,5,0,https://cdn.molhamteam.com/i/YmRxQHyAbSQ0WbTbydIM_thumb_1:1.jpg,2021,publishing_date,certain,2026-04-22T09:27:31.021287+00:00
306,https://molhamteam.com/en/campaigns/306,Molham Village Charitable Endowment (Waqf),,"Molham Village Charitable Endowment (Waqf)
Through this campaign, you may contribute in providing a decent shelter for IDPs and orphans in NW Syria within Molham Village, which is a long-term charitable endowment “Waqf”. The project consists of 300 apartments, in addition to a mosque, a school, and other facilities. Each apartment costs $4800. You may make a one-time donation of any amount, or pay the full price of an apartment by instalments over several months. You may also give any amount to support building the facilities that will serve the inhabitants of Molham Village, such as a school and mosque. For more info about this project, please contact us on WhatsApp: 00905367026447.","Through this campaign, you may contribute in providing a decent shelter for IDPs and orphans in NW Syria within Molham Village, which is a long-term charitable endowment “Waqf”. The project consists of 300 apartments, in addition to a mosque, a school, and other facilities. Each apartment costs $4800. You may make a one-time donation of any amount, or pay the full price of an apartment by instalments over several months. You may also give any amount to support building the facilities that will serve the inhabitants of Molham Village, such as a school and mosque. For more info about this project, please contact us on WhatsApp: 00905367026447.",150000,153116,-3116,150000,153116,-3116,488,0,10,0,https://cdn.molhamteam.com/i/NUszsoCeVuXPN0ZKjhsO_thumb_1:1.jpg,2021,publishing_date,certain,2026-04-22T09:27:31.041837+00:00
307,https://molhamteam.com/en/campaigns/307,A Loaf of Bread 2,,"A Loaf of Bread 2
As the prices of basic food supplies continue to increase and the economic situation of the IDPs camps in Syria worsens, displaced people struggle to put food on the table. This campaign aims at helping impoverished Syrian families with basic food supplies in the form of food parcels and bread. A donation of $10 will provide one displaced family with bread for a month.","As the prices of basic food supplies continue to increase and the economic situation of the IDPs camps in Syria worsens, displaced people struggle to put food on the table. This campaign aims at helping impoverished Syrian families with basic food supplies in the form of food parcels and bread. A donation of $10 will provide one displaced family with bread for a month.",52334,52334,0,52334,52334,0,974,0,14,0,https://cdn.molhamteam.com/i/FpUWyWLHLNHAPuWXwurq_thumb_1:1.jpg,2021,publishing_date,certain,2026-04-22T09:27:31.061468+00:00
308,https://molhamteam.com/en/campaigns/308,Behind Closed Doors - Humanitarian Cases Fund,,"Behind Closed Doors - Humanitarian Cases Fund
We come across many people in desperate need of help, but never ask for help. They just go on with their lives, working tirelessly to make a living for their families. Once we get to visit their homes, we witness the most extreme forms of deprivation. This is the reality of tens of families in NW Syria who experience immense suffering from behind the closed doors of their homes. This campaign is dedicated to shedding the light on their stories and alleviating their suffering. Every little donation you make goes a long way.","We come across many people in desperate need of help, but never ask for help. They just go on with their lives, working tirelessly to make a living for their families. Once we get to visit their homes, we witness the most extreme forms of deprivation. This is the reality of tens of families in NW Syria who experience immense suffering from behind the closed doors of their homes. This campaign is dedicated to shedding the light on their stories and alleviating their suffering. Every little donation you make goes a long way.",15109,15109,0,15109,15109,0,414,0,2,0,https://cdn.molhamteam.com/i/8B5qn8DgFAQIwUZYgnSn_thumb_1:1.jpg,2021,publishing_date,certain,2026-04-22T09:27:31.080066+00:00
309,https://molhamteam.com/en/campaigns/309,Heal A Broken Heart,,"This beautiful photo was taken for Abu Ibrahim while he was taking his daughter to school on the bicycle. His photo went viral on social media. We visited him today and asked about his living conditions. We found out that he was displaced from Aleppo and that he teaches Quran in a mosque. Therefore, we would like to provide him with better means for transportation, and also to get a present for his daughter. All incoming donations in this campaign will be dedicated to allowing him to start a new life. It is worth mentioning that this father never asked for anything, we reached him on our own initiative!",,12451,12451,0,12451,12451,0,407,0,3,0,https://cdn.molhamteam.com/i/RKosE8yRjlm7FYjRvNpf_thumb_1:1.jpg,2021,publishing_date,certain,2026-04-22T09:27:31.098854+00:00
310,https://molhamteam.com/en/campaigns/310,Give Warmth 15,,"“She isn’t able to talk or communicate with us since she was born, but despite all, she still goes everyday from the early morning to gather firewood” Batoul’s mother sorrowfully explained to us about her tough conditions, and inability to talk and communicate. She also talked about their suffering due to their displacement to Latakia countryside camps, and how Batoul helps through their struggles despite her illness. Batoul and thousands of other children and displaced families need your help, your donation to “Give Warmth 15” will ease their burdens. A donation of $50 will secure winter supplies for a family for a month. A donation of $20 will provide winter clothes for a displaced child. Every little donation goes a long way.",,421483,421483,0,421483,421483,0,13247,0,54,0,https://cdn.molhamteam.com/i/lv9wcXRssOynAQ5UpVzM_thumb_1:1.jpg,2021,publishing_date,certain,2026-04-22T09:27:31.119365+00:00
311,https://molhamteam.com/en/campaigns/311,World Orphans Day,,"This 11th of November is a special day dedicated for orphans - World Orphans Day. On this occasion, we launch this campaign to encourage all to join our orphan sponsorship program, to remind them that when a child misses one parent or both, he is deprived of his childhood and dreams. No child ever deserves to live with a broken heart. Everyone can help with as little as possible. This campaign will shed the light on the lives of orphans and the hardships they endure, hoping that this would contribute to improving their lives.",,134088,134088,0,134088,134088,0,820,0,10,0,https://cdn.molhamteam.com/i/MZfX96VQJeauDJqcOWBN_thumb_1:1.jpg,2021,publishing_date,certain,2026-04-22T09:27:31.137665+00:00
312,https://molhamteam.com/en/campaigns/312,Fruit Plate,,"In one of our field visits to a displaced family, we asked a child what would he like, and the answer really struck us. He said, “I want an apple”. The majority of us take many things we have at home for granted, but the very same things are wishes for families in camps. This campaign aims at offering fruit plates for displaced families. You may think providing fruits shouldn't be a priority, and this is exactly why we launch this campaign! These families always think about essentials when they receive financial support, and so they would probably never think about getting fruits for their children. A $7 donation will provide a fruit plate for a family and bring joy upon its children.",,9324,9324,0,9324,9324,0,343,0,2,0,https://cdn.molhamteam.com/i/AjLzrDcmIp4eIHoDJJWF_thumb_1:1.jpg,2021,publishing_date,certain,2026-04-22T09:27:31.155912+00:00
313,https://molhamteam.com/en/campaigns/313,Sponsorship of Humanitarian Cases,,"""I'm feeling overwhelmed, and all of the world's concerns are forced on me due to Mustafa's medical condition. After God, no one could help him except his brother and me. Mustafa was born with quadriplegia and hadn't had a good day since birth."" Mustafa is suffering from challenging health and living conditions. His mother is helpless and in pain because she has no one to turn to. Your $100 sponsorship will help secure the family's basic needs, alleviating their hopelessness. Your donation can make a difference. Your donations to this campaign will help Mustafa family and hundreds of other families",,51908,52012,-104,51908,52012,-104,1296,0,2,1,https://cdn.molhamteam.com/i/46YqjoYyf7XsekizTtH7_thumb_1:1.jpg,2021,publishing_date,certain,2026-04-22T09:27:31.174094+00:00
