campaign_id,url,title,subtitle,overview_text,details_text,required_amount_raw,paid_amount_raw,left_amount_raw,required_amount,paid_amount,left_amount,donations_count,comments_count,updates_count,shares_count,image_url,year_detected,year_source,date_status,scraped_at
1,https://molhamteam.com/en/campaigns/1,Razan's Fund for Cancer Patients,,"Razan's Fund for Cancer Patients
International relief organizations have discontinued support for Syrian refugees diagnosed with cancer. It is nearly impossible for refugees to afford treatment on their own. For that purpose, the team established Razan’s Fund for Cancer Patients, which currently sponsors a number of Syrian patients in Lebanon, Jordan, Turkey, and Syria.","International relief organizations have discontinued support for Syrian refugees diagnosed with cancer. It is nearly impossible for refugees to afford treatment on their own. For that purpose, the team established Razan’s Fund for Cancer Patients, which currently sponsors a number of Syrian patients in Lebanon, Jordan, Turkey, and Syria.",66176,66177,-1,66176,66177,-1,509,0,0,0,/og_default.jpeg,2015,publishing_date,certain,2026-04-22T09:27:25.409308+00:00
2,https://molhamteam.com/en/campaigns/2,Education Fund,,"Hundreds of thousands of Syrian children no longer attend school due to displacement. And large numbers of Syrian university students are unable to graduate because they cannot afford their last tuition installment. Through the Education Fund, we aim to provide tuition assistance to Syrian students of all ages.",,99777,99777,0,99777,99777,0,239,0,0,0,/og_default.jpeg,2015,publishing_date,certain,2026-04-22T09:27:25.427904+00:00
3,https://molhamteam.com/en/campaigns/3,Medical Emergencies Fund,,The Team receives a number of medical cases that require immediate assistance in countries of refuge. Thus we allocate funds that enable us to address their needs promptly.,,49551,49551,0,49551,49551,0,476,0,0,0,/og_default.jpeg,2015,publishing_date,certain,2026-04-22T09:27:25.447792+00:00
4,https://molhamteam.com/en/campaigns/4,Dialysis Fund,,This fund was established to help impoverished dialysis patients in rural areas receive the care they need by covering the cost of transportation to free dialysis centers.,,11591,11591,0,11591,11591,0,149,0,0,0,https://cdn.molhamteam.com/i/rwMkQVNZTc7V98M7XeEp_thumb_1:1.jpg,2015,publishing_date,certain,2026-04-22T09:27:25.467404+00:00
5,https://molhamteam.com/en/campaigns/5,Drinking Water Campaign,,A large number of families in Aleppo lost their primary providers and are unable to get water to their homes. The Team dedicated a vehicle for the purpose of delivering and filling their water tanks with drinking water every other day.,,41343,41343,0,41343,41343,0,124,0,0,0,/og_default.jpeg,2015,publishing_date,certain,2026-04-22T09:27:25.485102+00:00
6,https://molhamteam.com/en/campaigns/6,Give Warmth 9,,"This recurrent winter campaign aims to provide firelogs and diesel to families in Syria and in countries of asylum. As well as winter clothes and boots especially for children. The campaign will help families in Eastern and Western Ghouta, Hama, Idlib, and Lattakia Countrysides in Syria. In addition to Irsal and Beqa'a refugee camps in Lebanon and Za'atari Camp in Jordan.",,183408,183408,0,183408,183408,0,680,0,0,0,/og_default.jpeg,2015,publishing_date,certain,2026-04-22T09:27:25.505473+00:00
7,https://molhamteam.com/en/campaigns/7,Madaya- Supplying Food to Besieged Cities,,"Madaya- Supplying Food to Besieged Cities
Madaya is a city located about 40 kilometers from the capital, Damascus. It has been under siege for over 5 months. 40,000 civilians are currently in the besieged city, including 20,000 displaced residents of the nearby Zabadani. Madaya has been suffering from an extreme shortage of food and medical supplies for nearly 4 months. Its residents have had to eat leaves to survive. Over 100 cases of loss of consciousness are reported daily due to severe starvation. Men, women, and children are unable to purchase food since prices have skyrocketed. 1 kg of rice now costs over $150. Molham Volunteering Team is working on providing food to the besieged city of Madaya, and will deliver all funds received to its desperately-needing residents.","Madaya is a city located about 40 kilometers from the capital, Damascus. It has been under siege for over 5 months. 40,000 civilians are currently in the besieged city, including 20,000 displaced residents of the nearby Zabadani. Madaya has been suffering from an extreme shortage of food and medical supplies for nearly 4 months. Its residents have had to eat leaves to survive. Over 100 cases of loss of consciousness are reported daily due to severe starvation. Men, women, and children are unable to purchase food since prices have skyrocketed. 1 kg of rice now costs over $150. Molham Volunteering Team is working on providing food to the besieged city of Madaya, and will deliver all funds received to its desperately-needing residents.",737185,737185,0,737185,737185,0,3880,0,0,0,https://cdn.molhamteam.com/i/4nrx7VrJCu1LcKXRSdrK_thumb_1:1.jpg,2015,publishing_date,certain,2026-04-22T09:27:25.525207+00:00
8,https://molhamteam.com/en/campaigns/8,Medical Centers and Wounded Civilians Support Fund,,"Medical Centers and Wounded Civilians Support Fund
In addition to paying for individual medical treatments, Molham Volunteering Team provides the cost of transportation and living expenses to the injured. Moreover, the Team seeks to cover the rent and heating expenses of convalescent homes and rehabilitation centers in Syria and asylum countries. The Team currently pays for the following: - Diesel for medical transportation buses that drive patients to rehabilitation centers in Lattakia Countryside, Syria. - Rent for a convalescent home in Reyhanlı, Turkey. - Operation costs for an emergency center in Eastern Ghouta, Syria.","In addition to paying for individual medical treatments, Molham Volunteering Team provides the cost of transportation and living expenses to the injured. Moreover, the Team seeks to cover the rent and heating expenses of convalescent homes and rehabilitation centers in Syria and asylum countries. The Team currently pays for the following: - Diesel for medical transportation buses that drive patients to rehabilitation centers in Lattakia Countryside, Syria. - Rent for a convalescent home in Reyhanlı, Turkey. - Operation costs for an emergency center in Eastern Ghouta, Syria.",76445,76445,0,76445,76445,0,125,0,0,0,https://cdn.molhamteam.com/i/OsJ0J609ASLSpAFAfNPU_thumb_1:1.jpg,2015,publishing_date,certain,2026-04-22T09:27:25.546251+00:00
9,https://molhamteam.com/en/campaigns/9,Response Campaign for Lattakia Countryside,,"Response Campaign for Lattakia Countryside
An emergency campaign to provide bare necessities for families displaced after Russian airstrikes in Lattakia Countryside. Thousands of Syrians fled their homes to the Turkish border and are currently living out in the open with trees their only shelter. They have no tents, blankets, or even restrooms. We are working on delivering tents and blankets for them as soon as possible, as the weather is reaching near-zero temperatures.","An emergency campaign to provide bare necessities for families displaced after Russian airstrikes in Lattakia Countryside. Thousands of Syrians fled their homes to the Turkish border and are currently living out in the open with trees their only shelter. They have no tents, blankets, or even restrooms. We are working on delivering tents and blankets for them as soon as possible, as the weather is reaching near-zero temperatures.",16960,16960,0,16960,16960,0,117,0,0,0,https://cdn.molhamteam.com/i/0Iz9nyYMKYiqziVMA0BF_thumb_1:1.jpg,2015,publishing_date,certain,2026-04-22T09:27:25.565586+00:00
10,https://molhamteam.com/en/campaigns/10,Here's Douma,,"The city of Douma was the target of more than 15 airstrikes which injured over 200 and claimed the lives of 50 civilians, many of whom were students and teachers. Homes were reduced to rubble, and medical centers suffered significant damage. The goal of this campaign is to provide basic necessities to the people of Douma.",,20407,20407,0,20407,20407,0,162,0,0,0,https://cdn.molhamteam.com/i/5nw9VahG8sfze493b6Z7_thumb_1:1.jpg,2015,publishing_date,certain,2026-04-22T09:27:25.583811+00:00
11,https://molhamteam.com/en/campaigns/11,Emergency Campaign ... Palestine 48 to secure warmth for Syrians,,"Emergency Campaign ... Palestine 48 to secure warmth for Syrians
this campaign aims to provide winter gear for our people in refugee camps in Syria. In these camps, kids will be in danger because temperature reaches 0 °C. Therefore, our team is collecting donations to buy diesel, wood and clothes for these families...","this campaign aims to provide winter gear for our people in refugee camps in Syria. In these camps, kids will be in danger because temperature reaches 0 °C. Therefore, our team is collecting donations to buy diesel, wood and clothes for these families...",30000,30000,0,30000,30000,0,48,0,0,0,https://cdn.molhamteam.com/i/EZcXQWOW8YEcKUYniPN6_thumb_1:1.jpg,2016,publishing_date,certain,2026-04-22T09:27:25.603012+00:00
12,https://molhamteam.com/en/campaigns/12,providing formula milk for infants,,providing formula milk for infants,"molham volunteering team seeks to provide formula milk for infants in the under siege cities, illegal and forgotten refugee camps. where the bottle price in some regions reaches more than 10 USD , approximately 3600 Syrian pounds and it goes even higher in the under siege cities to exceed 5000 Syrian pound if any. due to the infant's essential need for the formula and to prevent any case of malnutrition, hereby we are launching this campaign to provide it for all infants in al rastan, moua'admiat alsham and the under siege ghouta",43331,43331,0,43331,43331,0,108,0,0,0,https://cdn.molhamteam.com/i/5GvfV1UPtAQISlGKAD0F_thumb_1:1.jpg,2016,publishing_date,certain,2026-04-22T09:27:25.621763+00:00
13,https://molhamteam.com/en/campaigns/13,Response - Emergency fund,,"We seek through that campaign to supply the essential materials for our families in scared cities that face bombs and for the trapped in the besieged cities. As well we are trying to supply same materials for the displaced people to North Syria after the last displacement from Homs,, Damascus suburb and Aleppo to Northern Syria.",,178692,178692,0,178692,178692,0,451,0,0,0,https://cdn.molhamteam.com/i/emaQUIq6HJ9XzHVa4TyS_thumb_1:1.jpg,2016,publishing_date,certain,2026-04-22T09:27:25.640107+00:00
14,https://molhamteam.com/en/campaigns/14,Response Campaign - Save Aleppo,,"Response Campaign - Save Aleppo
On February 5, 2016, we launched a campaign to respond to the needs of families in the city and Northern Countryside of Aleppo, as well as the displaced families stranded along the Turkish border. Aleppo has yet again been the target of heavy and brutal airstrikes for the past several days, renewing the need for instant relief. Molham Volunteering Team resumes the campaign (Save Aleppo) to provide basic necessities to families of the dead and wounded and those affected by the constant shelling of the city.","On February 5, 2016, we launched a campaign to respond to the needs of families in the city and Northern Countryside of Aleppo, as well as the displaced families stranded along the Turkish border. Aleppo has yet again been the target of heavy and brutal airstrikes for the past several days, renewing the need for instant relief. Molham Volunteering Team resumes the campaign (Save Aleppo) to provide basic necessities to families of the dead and wounded and those affected by the constant shelling of the city.",221307,221307,0,221307,221307,0,1447,0,0,0,https://cdn.molhamteam.com/i/NnjYQPnHWKaBhGc53vwu_thumb_1:1.jpg,2016,publishing_date,certain,2026-04-22T09:27:25.659247+00:00
15,https://molhamteam.com/en/campaigns/15,You Are My Mother,,"March 21st marks Mother’s Day in the Middle East. To celebrate the love, strength, and sacrifices of mothers worldwide, Molham Volunteering Team is launching a new campaign under the name: “You Are My Mother.” This year, you can get your mother a unique gift by sponsoring an orphan or supporting our clean water project in her name. You can also choose to honor mothers and wives of martyrs and detainees in and around Syria. Our volunteers will visit those brave, grieving women and deliver your gift under your and your mother’s names. You can make this Mother’s Day special in 3 simple steps: 1- Make a donation in the amount you desire. 2- Send an e-mail to
and let us know your mother’s name, and how you wish to dedicate your gift. We will send you a card in her name. 3- Send the card to your mom and watch her smile! Happy Mother’s Day!","March 21st marks Mother’s Day in the Middle East. To celebrate the love, strength, and sacrifices of mothers worldwide, Molham Volunteering Team is launching a new campaign under the name: “You Are My Mother.” This year, you can get your mother a unique gift by sponsoring an orphan or supporting our clean water project in her name. You can also choose to honor mothers and wives of martyrs and detainees in and around Syria. Our volunteers will visit those brave, grieving women and deliver your gift under your and your mother’s names. You can make this Mother’s Day special in 3 simple steps: 1- Make a donation in the amount you desire. 2- Send an e-mail to motherday@molhamteam.com and let us know your mother’s name, and how you wish to dedicate your gift. We will send you a card in her name. 3- Send the card to your mom and watch her smile! Happy Mother’s Day!",8579,8579,0,8579,8579,0,105,0,0,0,https://cdn.molhamteam.com/i/aYQhUfUrtcKoVPdUletb_thumb_1:1.jpg,2016,publishing_date,certain,2026-04-22T09:27:25.677707+00:00
16,https://molhamteam.com/en/campaigns/16,Dream box - Idleb University,,"Dream box - Idleb University
Although there are war, bombing and destroyed but there are many of university students are dreaming to finish their education and graduate from college to build their country... More than 500 students they can't attend the next year to complete their studies in the university due thier bad financial situation so they can't pay their tuition fees of a (100$) for each student in one semester, so as we are a volunteering team we are trying to collect some indeed students tuition","Although there are war, bombing and destroyed but there are many of university students are dreaming to finish their education and graduate from college to build their country... More than 500 students they can't attend the next year to complete their studies in the university due thier bad financial situation so they can't pay their tuition fees of a (100$) for each student in one semester, so as we are a volunteering team we are trying to collect some indeed students tuition",3064,3064,0,3064,3064,0,36,0,0,0,https://cdn.molhamteam.com/i/sABCzmEfa67E31LkGQCC_thumb_1:1.jpg,2016,publishing_date,certain,2026-04-22T09:27:25.695643+00:00
17,https://molhamteam.com/en/campaigns/17,Children fund,,"Inasmuch of what our children suffering in the besieged areas and countries of asylum, so our team is seeking to redraw the smile in these children faces through organizing carnivals, and give them money during the feast period",,23162,23162,0,23162,23162,0,46,0,0,0,https://cdn.molhamteam.com/i/c1g7VBO6zSsdPoZgaRQi_thumb_1:1.jpg,2016,publishing_date,certain,2026-04-22T09:27:25.715432+00:00
18,https://molhamteam.com/en/campaigns/18,Ramadan Campaign for Kids.,,The team seeks During Ramadan Al-Mubarak to provide Psychosocial support to the children who live inside Syria and the countries of Refugee by establishing a Ramadan camps aimed at alleviating the suffering of the war for them through a variety of programs and recreational activities ..,,2112,2112,0,2112,2112,0,4,0,0,0,https://cdn.molhamteam.com/i/iN9zFoskC2R5K4s6iEqa_thumb_1:1.jpg,2016,publishing_date,certain,2026-04-22T09:27:25.733520+00:00
19,https://molhamteam.com/en/campaigns/19,Support medical and humanitarian cases.,,"Support medical and humanitarian cases.
The team continues to get medical support for cases of injured people, children and urgent surgeries during Ramadan Al-Mubarak .. The team also seeks to provide a subsidy to the largest possible number of indeed families inside Syria and the countries of refugee during the Month of Ramadan AlKareem ..","The team continues to get medical support for cases of injured people, children and urgent surgeries during Ramadan Al-Mubarak .. The team also seeks to provide a subsidy to the largest possible number of indeed families inside Syria and the countries of refugee during the Month of Ramadan AlKareem ..",9065,9065,0,9065,9065,0,54,0,0,0,https://cdn.molhamteam.com/i/XkAHTavvaIFTbTmwEVcO_thumb_1:1.jpg,2016,publishing_date,certain,2026-04-22T09:27:25.752947+00:00
20,https://molhamteam.com/en/campaigns/20,Orphans Sponsor Fund,,"1000 children in more than 25 different areas lost one of their parents, or both of them in the war and left without the love and support of the family. They live in war and destruction and they have one thing in common; their big dreams. To help our 1000 children make their dreams come true with a better future, please support ,orphans sponsor fund.",,80565,80565,0,80565,80565,0,590,0,0,0,https://cdn.molhamteam.com/i/BDnBpHKVrMphyG2Srgc7_thumb_1:1.jpg,2016,publishing_date,certain,2026-04-22T09:27:25.771607+00:00
21,https://molhamteam.com/en/campaigns/21,Breakfast and Money Zakaat.,,The team receives breakfast and money zakaat during Ramadan Al-Mubarak to ensure deliver them to recipients inside Syria and the countries of refugee,,15303,15303,0,15303,15303,0,42,0,0,0,https://cdn.molhamteam.com/i/ct1EX5UpRAwRAZ6HqHi3_thumb_1:1.jpg,2016,publishing_date,certain,2026-04-22T09:27:25.790526+00:00
22,https://molhamteam.com/en/campaigns/22,Breakfast for a fasting - food baskets,,"Breakfast for a fasting - food baskets
The team is trying to distribute food parcels and Suhoor baskets to afford the needs of the largest possible number of Syrian families affected during Ramadan Al-Mubarak .. and make sure that breakfasts is ready and help to establishing a charitable kitchens inside Syria and the countries of refugee.",The team is trying to distribute food parcels and Suhoor baskets to afford the needs of the largest possible number of Syrian families affected during Ramadan Al-Mubarak .. and make sure that breakfasts is ready and help to establishing a charitable kitchens inside Syria and the countries of refugee.,62073,62073,0,62073,62073,0,88,0,0,0,https://cdn.molhamteam.com/i/RQdfhxg1o86nCiMK5AjW_thumb_1:1.jpg,2016,publishing_date,certain,2026-04-22T09:27:25.808919+00:00
23,https://molhamteam.com/en/campaigns/23,Basmet Amal 7,,"We seek through Basmet Amal 7 to get clothes and feast Money for Syrian children who deprived of their most basic rights to life. More than 5 million Syrian children deprived from feast joy, because of asylum, displacement and displacement by Syrian goverment .",,4373,4373,0,4373,4373,0,12,0,0,0,https://cdn.molhamteam.com/i/bExH80PS4lfeSibwd8MN_thumb_1:1.jpg,2016,publishing_date,certain,2026-04-22T09:27:25.827884+00:00
24,https://molhamteam.com/en/campaigns/24,Respond- Idleb,,"In the last few days Idleb was exposed to Assad's and Russian Raids, thousands of people flee Idleb and became homeless. Idleb welcomed thousand and thousand refugees as it got its freedom ... and Today Idlib is in desperate needs to our support..",,36680,36680,0,36680,36680,0,359,0,0,0,https://cdn.molhamteam.com/i/gGboWrNIQtL05iku28p2_thumb_1:1.jpg,2016,publishing_date,certain,2026-04-22T09:27:25.846638+00:00
25,https://molhamteam.com/en/campaigns/25,Supplying Beseiged Areas with Meats,,"Supplying Beseiged Areas with Meats
Today, we're going to distribute 100 lamb for the 4 cities that still under siege in Syria, in celebration of Aleepo's siege breaking, our prays to Allah to break the siege on the rest of the cities...","Today, we're going to distribute 100 lamb for the 4 cities that still under siege in Syria, in celebration of Aleepo's siege breaking, our prays to Allah to break the siege on the rest of the cities...",35358,35358,0,35358,35358,0,139,0,0,0,https://cdn.molhamteam.com/i/n4642m5Y5ntC9ugkqVEV_thumb_1:1.jpg,2016,publishing_date,certain,2026-04-22T09:27:25.865303+00:00
26,https://molhamteam.com/en/campaigns/26,Sacrificial feast.,,we are launching a campaign for sacrificial feast to distribute sacrificial meat inside Syria and asylum countries and particularly the cities that's under siege. In the past feast we slaughtered more than 400 sacrificial lamb and we distributed to thousands of families in more than 40 areas in Syria ... The price of the sacrifice is $ 200 ... the calf price ranges between 1000 to $ 1400 depending on the area and weight ...,,78419,78419,0,78419,78419,0,175,0,0,0,https://cdn.molhamteam.com/i/aYFrqiZL5uVuMQ4ak0xf_thumb_1:1.jpg,2016,publishing_date,certain,2026-04-22T09:27:25.883465+00:00
27,https://molhamteam.com/en/campaigns/27,Basmet Amal 8,,"We seek through Basmet Amal 7 to get clothes and feast Money for Syrian children who deprived of their most basic rights to life. More than 5 million Syrian children deprived from feast joy, because of asylum, displacement and displacement by Syrian goverment .",,9835,9835,0,9835,9835,0,161,0,0,0,https://cdn.molhamteam.com/i/cCBfZxe21oVJanyF9xQy_thumb_1:1.jpg,2016,publishing_date,certain,2026-04-22T09:27:25.904335+00:00
28,https://molhamteam.com/en/campaigns/28,Urgent giving-birth cases,,"Many hospitals refuse receiving many giving-birth cases because they can not afford hospitalization expenses... Although the time limitation and urgency but Hundreds of these cases were fully funded, and we are looking forward to have a faster response to these kind of urgent cases",,4509,4509,0,4509,4509,0,95,0,0,0,https://cdn.molhamteam.com/i/KJzzyU8ntODKZbsA5z4c_thumb_1:1.jpg,2016,publishing_date,certain,2026-04-22T09:27:25.923838+00:00
29,https://molhamteam.com/en/campaigns/29,Generations,,"By each educational year passing, many of Syrian kids are deprived from their basic humanitarian right of education because their parents can't afford paying their tuition. Our team seeks to provide the tuition for the students in Syria and asylum countries. In addition, our team also seeks to provide school stationaries for those in need.",,11222,11222,0,11222,11222,0,189,0,0,0,https://cdn.molhamteam.com/i/0AUIVuhsOx9ppjQ9G2JW_thumb_1:1.jpg,2016,publishing_date,certain,2026-04-22T09:27:25.942977+00:00
30,https://molhamteam.com/en/campaigns/30,Molham Giving Day,,"In celebration of the fourth anniversary of establishing Molham Volunteering Team on 26/10/2016. Today, starting at 12 A.M Syrian time and for 24 hours till the end of Wednesday the 26th of October, your donation is going to be MATCHED. Luckily and in an unprecedented manner, any donation you make today, there's a Philanthropist that decided to donate the same amount you are trying to donate in order to raise more money for this cause. This campaign's goal is to distribute winter clothes to Syrian kids in refugee camps.",,72485,72485,0,72485,72485,0,523,0,0,0,https://cdn.molhamteam.com/i/B0nR57B9Rfwq0GQkV3FK_thumb_1:1.jpg,2016,publishing_date,certain,2026-04-22T09:27:25.961744+00:00
31,https://molhamteam.com/en/campaigns/31,Give Warmth 10,,"This recurrent winter campaign aims to provide firelogs and diesel to families in Syria and in countries of asylum. As well as winter clothes and boots especially for children. The campaign will help families in Eastern and Western Ghouta, Hama, Idlib, and Lattakia Countrysides in Syria. In addition to Irsal and Beqa'a refugee camps in Lebanon and Za'atari Camp in Jordan.",,198566,198566,0,198566,198566,0,852,0,0,0,https://cdn.molhamteam.com/i/Uvd7xqCCZBczdQKDcaxP_thumb_1:1.jpg,2016,publishing_date,certain,2026-04-22T09:27:25.980462+00:00
32,https://molhamteam.com/en/campaigns/32,Molham Kindergarten,,"Children became ignorant after closing all schools and kindergartens in Al-Yarmouk Camp, and specially after they were displaced. Our team turned an abandoned traditional house into a kindergarten that has more than 100 child. Most of the children in this kindergarten are from Al-Yarmouk Camp. This project aims to give children one of their basic rights, education.",,28582,28582,0,28582,28582,0,138,0,0,0,https://cdn.molhamteam.com/i/yUWACqVQyc8Tr63MUVuH_thumb_1:1.jpg,2016,publishing_date,certain,2026-04-22T09:27:26.000103+00:00
33,https://molhamteam.com/en/campaigns/33,Support for Orphanages,,"Many orphanages lack the most basic needs and services. These centers shelter orphans who lost their houses completely. Through this campaign, our team aims to provide support for these facilities and help them provide more care and support for orphans.",,300000,333923,-33923,300000,333923,-33923,251,0,0,0,https://cdn.molhamteam.com/i/um3ehzSZaAUEml2P71q0_thumb_1:1.jpg,2016,publishing_date,certain,2026-04-22T09:27:26.018710+00:00
34,https://molhamteam.com/en/campaigns/34,Help me help others,,"Muhammad Sultan and Muhammad Al-Faran, two young Syrian men from Belgium are taking part in a sponsored challenge of driving bicycle across 99km! All proceeds will be used for our education projects. Both Muhammads need your support to reach out to as many deprived children as possible, especially those stranded in tents in refugee camps. Education is a must for them and we will help them!",,20951,20951,0,20951,20951,0,75,0,0,0,https://cdn.molhamteam.com/i/WuIHgsX6Sgmsrtqwt2G4_thumb_1:1.jpg,2016,publishing_date,certain,2026-04-22T09:27:26.039025+00:00
