campaign_id,url,title,subtitle,overview_text,details_text,required_amount_raw,paid_amount_raw,left_amount_raw,required_amount,paid_amount,left_amount,donations_count,comments_count,updates_count,shares_count,image_url,year_detected,year_source,date_status,scraped_at
537,https://molhamteam.com/en/campaigns/537,Urgent Cases,,"""The heater exploded in the face of little Ahmad, and the fire raged on his face for about a minute. There was nothing that could describe his screams and pain. The child Ahmad was transferred to Turkey. He waited for hours on the road, and this caused him significant problems in his lungs and kidneys, to the point that the percentage of his death became 80%! Today marks a year and a half since the incident with the child Ahmad. Until now, he can't sleep because his eyelids are now drooping, and he has lost the ability to move what remains of his body. The living conditions for Ahmed and his family are very poor. They are living with two other families, and their ability to secure their necessities and the medical needs of their child is nonexistent. Any donation could be the salvation for Ahmad and his family.",,100000,118205,-18205,100000,118205,-18205,1391,0,0,7,https://cdn.molhamteam.com/i/sFUSWugXn34O686SKoUz_thumb_1:1.jpg,2024,publishing_date,certain,2026-04-22T09:27:35.301959+00:00
538,https://molhamteam.com/en/campaigns/538,Humanitarian Sponsorships 2024,,"Abdulkareem was born with pemphigus that causes him unbearable pain. He needs daily treatment to fight his pain. Abdukareem’s father has a paralyzed hand’s palm following a bombardment on his city. He can’t work to provide for Abdukareem’s treatment necessities such as gauze, ointments, and medicine. Your generous donations will for sure help alleviate Abdulkareem’s suffering. Don’t hesitate.",,75000,50241,24759,75000,50241,24759,588,1,0,3,https://cdn.molhamteam.com/i/24MH1ROqEVdDMiyZeAJe_thumb_1:1.jpg,2024,title,certain,2026-04-22T09:27:35.319664+00:00
540,https://molhamteam.com/en/campaigns/540,Medical Cases 2024,,"Fawzia is a young kid who knows nothing but sorrow and misery. Her family's extreme needs prevented her from enjoying a lot of life's pleasures and basic childhood rights like food, clothing, and toys. Adding to the problems, a terrible fire destroyed her family's home and all of its things! The small girl suffered severe burns on her face and needed immediate medical attention. Take the opportunity to lend a helping hand to her because her pains are horrible! Today, it is your turn to be a support for Fawzia, to reduce her pain and bring back the smile to her sweet face",,50000,68477,-18477,50000,68477,-18477,1107,0,0,9,https://cdn.molhamteam.com/i/c3VAVb9UCCFHC9fT24uU_thumb_1:1.jpg,2024,title,certain,2026-04-22T09:27:35.338710+00:00
541,https://molhamteam.com/en/campaigns/541,Broken Childhood 2024,,"Hundreds of children in northern Syria are suffering from difficult living conditions. Therefore, we have launched the “Broken Childhood 2024” campaign to support and sponsor them by securing their basic needs. Donate to children who are out of education and deprived of a normal childhood because they have to work. Your support can change their lives and put them back on the right track by helping them go back to school.",,30000,20910,9090,30000,20910,9090,406,1,0,5,https://cdn.molhamteam.com/i/fGKnNHxvxlTDhExXOoKe_thumb_1:1.jpg,2024,title,certain,2026-04-22T09:27:35.357293+00:00
542,https://molhamteam.com/en/campaigns/542,Zakat al-Mal,,"Through this campaign, we receive your zakat throughout the year so that it is disbursed to those who deserve it, including the needy, the displaced, the sick, orphans, students, and homeless families inside Syria and countries of asylum, according to the legitimate zakat channels.",,600000,465729,134271,600000,465729,134271,1209,2,5,4,https://cdn.molhamteam.com/i/wNe9otg7C72sIW5lJZ6m_thumb_1:1.jpg,2024,publishing_date,certain,2026-04-22T09:27:35.375501+00:00
543,https://molhamteam.com/en/campaigns/543,Molham Giving Day !,,"Your donation today is doubled for this campaign, and every dollar you donate will reach us doubled by our donors. A child is left in a room alone because of his smell. Abdul Rahman is a young child who was born with a rare disease of psoriasis with redness all over his body. Psoriasis causes a lot of suffering for the child, but due to the extreme poverty of the family, they are unable to provide him with the treatment he needs, so they leave him in a room alone. The child is in dire and urgent need of your help to receive the necessary treatment, so do not delay it and be the reason for his release from isolation and alleviation of his pain! In this campaign, a group of donors will match any amount you donate, so if you donate a dollar, we will receive two dollars... and whatever your ability... today the impact of your donation is greater. More children and families will receive aid! Donate today, and bring a smile instead of two! All amounts received on the Inspiring Day of Giving will be spent to secure the humanitarian needs, warmth, shelter, and living expenses of displaced families residing in camps, shelter centers, and homes whose families are suffering from tragic conditions.",,258289,258264,,258289,258264,,2111,5,0,20,https://cdn.molhamteam.com/i/XNe3oU3AJTw7HlPg4plY_thumb_1:1.jpg,2024,publishing_date,certain,2026-04-22T09:27:35.394389+00:00
544,https://molhamteam.com/en/campaigns/544,Molham Team Iftar in Canada,,"Molham Team Iftar in Canada
Join us for our first ever iftar in Canada - Mississauga The Molham family in Canada is excited to invite you to its first Ramdan Iftar Which aims to bring joy to the lives of orphaned children. All proceeds from the ticket sales for the iftar will go towards purchasing Eid clothes for internally-displaced orphan children in northwest Syria to bring joy & dignity to children in need Data: Friday, March 15, 2024 - 6pm Address: Sagan Banquet Hall - 7180 Edwards Blvd, Mississauga, ON L5S 1Z1 Purchase your ticket for the iftar & make a difference in the lives of Syrian children! Tickets: $30 CAD /person May Allah reward you abundantly","Join us for our first ever iftar in Canada - Mississauga The Molham family in Canada is excited to invite you to its first Ramdan Iftar Which aims to bring joy to the lives of orphaned children. All proceeds from the ticket sales for the iftar will go towards purchasing Eid clothes for internally-displaced orphan children in northwest Syria to bring joy & dignity to children in need Data: Friday, March 15, 2024 - 6pm Address: Sagan Banquet Hall - 7180 Edwards Blvd, Mississauga, ON L5S 1Z1 Purchase your ticket for the iftar & make a difference in the lives of Syrian children! Tickets: $30 CAD /person May Allah reward you abundantly",5725,9467,-3742,5725,9467,-3742,141,2,0,7,https://cdn.molhamteam.com/i/qbi0IdfxSPsJAiX2S6N9_thumb_1:1.jpg,2024,publishing_date,certain,2026-04-22T09:27:35.413490+00:00
545,https://molhamteam.com/en/campaigns/545,Winter in Tents,,"The ""Winter in Tents"" campaign is an advocacy campaign to alleviate the suffering of displaced people living in tents during winter. A million people in northwestern Syria and thousands in refugee camps outside Syria are waiting for your support. Your donation can significantly impact their lives.",,5562,5563,-1,5562,5563,-1,97,0,0,1,https://cdn.molhamteam.com/i/CQEZ9F71OdQxYchIVWHi_thumb_1:1.jpg,2024,publishing_date,certain,2026-04-22T09:27:35.432244+00:00
546,https://molhamteam.com/en/campaigns/546,Molham Team Iftar in Michigan,,"Molham Team Iftar in Michigan
Join us at our first charity dinner in Michigan on 03/31/2024 at MCM ( Muslim Community Mosque ). Our team will organize this event. Every ticket purchase directly supports IDP children and refugees in refugee camps. With your help, we'll provide them with new clothes for Eid, bringing joy and dignity to those in need. Your ticket is not just a meal; it's a gesture of compassion and solidarity that will make a meaningful difference in the lives of these children. Buy your ticket today for 30$ and help us spread joy and happiness this Eid season. The schedule for the Iftar program will be provided to you in the coming days. May Allah reward you abundantly.","Join us at our first charity dinner in Michigan on 03/31/2024 at MCM ( Muslim Community Mosque ). Our team will organize this event. Every ticket purchase directly supports IDP children and refugees in refugee camps. With your help, we'll provide them with new clothes for Eid, bringing joy and dignity to those in need. Your ticket is not just a meal; it's a gesture of compassion and solidarity that will make a meaningful difference in the lives of these children. Buy your ticket today for 30$ and help us spread joy and happiness this Eid season. The schedule for the Iftar program will be provided to you in the coming days. May Allah reward you abundantly.",10000,7530,2470,10000,7530,2470,113,1,0,13,https://cdn.molhamteam.com/i/V4QZAJb0zukN0ADcRAbd_thumb_1:1.jpg,2024,publishing_date,certain,2026-04-22T09:27:35.452938+00:00
547,https://molhamteam.com/en/campaigns/547,Molham Team Iftar in Chicago,,"Molham Team Iftar in Chicago
Join us at our first charity dinner in Chicago on 03/22/2024 at Ashton Place, organized by our team. Every ticket purchase directly supports IDP children and refugees in refugee camps. With your help, we'll provide them with new clothes for Eid, bringing joy and dignity to those in need. Your ticket is not just a meal; it's a gesture of compassion and solidarity that will make a meaningful difference in the lives of these children. Buy your ticket today for 30$ and help us spread joy and happiness this Eid season. The schedule for the Iftar program will be provided to you in the coming days. May Allah reward you abundantly.","Join us at our first charity dinner in Chicago on 03/22/2024 at Ashton Place, organized by our team. Every ticket purchase directly supports IDP children and refugees in refugee camps. With your help, we'll provide them with new clothes for Eid, bringing joy and dignity to those in need. Your ticket is not just a meal; it's a gesture of compassion and solidarity that will make a meaningful difference in the lives of these children. Buy your ticket today for 30$ and help us spread joy and happiness this Eid season. The schedule for the Iftar program will be provided to you in the coming days. May Allah reward you abundantly.",4990,5003,-13,4990,5003,-13,77,0,0,6,https://cdn.molhamteam.com/i/ndkiSZwnwn5Al1Y1HNpi_thumb_1:1.jpg,2024,publishing_date,certain,2026-04-22T09:27:35.472044+00:00
548,https://molhamteam.com/en/campaigns/548,Urgent Humanitarian Cases,,"""Fatima was born five years ago. Her mother has been suffering specifically after her husband passed away due to a heart attack two years ago. She, alone, takes care of her three children including lovely Fatima who was born with no legs and deformed hands. Moreover, she can't eat because she suffers from intestinal problems and she can only drink milk. Fatima and her family live in a damp cold shop under tragic conditions. They are helpless and they can't even secure their food. Fatima and her family have been facing heartbreaking days. Your donation can ease their suffering and significantly change their lives.""",,70000,53494,16506,70000,53494,16506,744,1,1,4,https://cdn.molhamteam.com/i/hEF8xY1ucf3i5RdrxXRU_thumb_1:1.jpg,2024,publishing_date,certain,2026-04-22T09:27:35.491761+00:00
549,https://molhamteam.com/en/campaigns/549,Proceeds from Molham Store products,,"Proceeds from Molham Store products
Molham Store offers products crafted with love and expertise, designed to resonate with the very essence of humanity we carry within us, no matter where life takes us. Our collection features a curated selection of distinct designs infused with inspiring concepts, each one a reflection of our rich cultural heritage, evoking memories as fragrant as the scent of tradition itself. Every purchase from Molham Store directly contributes to the noble cause of educating and sponsoring orphaned children. With each transaction, you're not just acquiring a unique piece from our store; you're also investing in the future of deserving young lives. Join us in making a difference. Complete your purchase today, and let your support echo through the halls of education and opportunity for those who need it most.","Molham Store offers products crafted with love and expertise, designed to resonate with the very essence of humanity we carry within us, no matter where life takes us. Our collection features a curated selection of distinct designs infused with inspiring concepts, each one a reflection of our rich cultural heritage, evoking memories as fragrant as the scent of tradition itself. Every purchase from Molham Store directly contributes to the noble cause of educating and sponsoring orphaned children. With each transaction, you're not just acquiring a unique piece from our store; you're also investing in the future of deserving young lives. Join us in making a difference. Complete your purchase today, and let your support echo through the halls of education and opportunity for those who need it most.",20000,18472,1528,20000,18472,1528,235,0,0,2,https://cdn.molhamteam.com/i/ATXlbPbhWMimcpdbG6TH_thumb_1:1.jpg,2024,publishing_date,certain,2026-04-22T09:27:35.511347+00:00
550,https://molhamteam.com/en/campaigns/550,Restoring Hope: Support Anas's Physical Therapy Journey,,"Restoring Hope: Support Anas's Physical Therapy Journey
Mohammed suffered serious muscle atrophy at his youth, causing him to lose his ability to walk, stand balanced, and take part in different bodily activities. Mohammed's health is improving as a result of his treatment at the Molham Centre for Physical Therapy, which provides full medical care. Your donations to the centre benefit Mohammed and many other patients who require assistance. Be a gentle hand that heals their hearts and supports them.","Mohammed suffered serious muscle atrophy at his youth, causing him to lose his ability to walk, stand balanced, and take part in different bodily activities. Mohammed's health is improving as a result of his treatment at the Molham Centre for Physical Therapy, which provides full medical care. Your donations to the centre benefit Mohammed and many other patients who require assistance. Be a gentle hand that heals their hearts and supports them.",60000,53765,6235,60000,53765,6235,262,0,2,3,https://cdn.molhamteam.com/i/y7VjiJt5vM2IPEnWTxH4_thumb_1:1.jpg,2024,publishing_date,certain,2026-04-22T09:27:35.529080+00:00
551,https://molhamteam.com/en/campaigns/551,Life Savers 3,,"The incredible pain is over Issa's ability, as he is only one year old! Issa suffered burns as a result of a fuel can explosion. The burns had a major effect on the child's health, as his small body was unable to deal with the pain. He requires different drugs to reduce his pain, as well as continuous follow-up care by a doctor to ensure his health. Your donation of a little money for the kid is sufficient to cover the costs of his care, reduce his sadness, and prevent him from further harm. Be a kind hand that removes his suffering and saves him.",,150000,134560,15440,150000,134560,15440,1682,2,21,8,https://cdn.molhamteam.com/i/UCHSsbMc9ZmtgBE4qf85_thumb_1:1.jpg,2024,publishing_date,certain,2026-04-22T09:27:35.550216+00:00
553,https://molhamteam.com/en/campaigns/553,Food Packaged for Orphan's Families. Ramadan 2024,,"Food Packaged for Orphan's Families. Ramadan 2024
During the sacred month of Ramadan, as families gather around Iftar and Suhoor tables, it's a time of reflection and gratitude. However, for many families, these tables lack even the most basic necessities, making it a struggle to provide a meal for their children. You can make a meaningful difference by contributing $65 to provide a Ramadan basket for an orphan family. These baskets contain essential food items to cover their Suhoor and Iftar meals throughout the holy month, ensuring that they can observe Ramadan with dignity and sustenance. Join us in spreading hope and compassion during this blessed time.","During the sacred month of Ramadan, as families gather around Iftar and Suhoor tables, it's a time of reflection and gratitude. However, for many families, these tables lack even the most basic necessities, making it a struggle to provide a meal for their children. You can make a meaningful difference by contributing $65 to provide a Ramadan basket for an orphan family. These baskets contain essential food items to cover their Suhoor and Iftar meals throughout the holy month, ensuring that they can observe Ramadan with dignity and sustenance. Join us in spreading hope and compassion during this blessed time.",50000,42650,7350,50000,42650,7350,370,0,0,1,https://cdn.molhamteam.com/i/RxiX8HGehSBZ80v0y03c_thumb_1:1.jpg,2024,title,certain,2026-04-22T09:27:35.569556+00:00
554,https://molhamteam.com/en/campaigns/554,Sponsor an Orphan- Ramadan 2024,,"Sponsor an Orphan- Ramadan 2024
In the shadows of conflict, every orphaned child carries a story laden with pain and a box of secrets known only to God. As the grip of war tightens, their suffering intensifies, and their dreams shrink to the basic necessities of life—a livelihood and a sheltering roof. In this sacred month, let us extend our hands to these vulnerable children through the ""Sponsor an Orphan Child"" campaign. Your generous donations will be a beacon of hope, transforming their reality during Ramadan. Do not miss this opportunity to make a profound difference and reap the blessings of your kindness.","In the shadows of conflict, every orphaned child carries a story laden with pain and a box of secrets known only to God. As the grip of war tightens, their suffering intensifies, and their dreams shrink to the basic necessities of life—a livelihood and a sheltering roof. In this sacred month, let us extend our hands to these vulnerable children through the ""Sponsor an Orphan Child"" campaign. Your generous donations will be a beacon of hope, transforming their reality during Ramadan. Do not miss this opportunity to make a profound difference and reap the blessings of your kindness.",100000,97823,2177,100000,97823,2177,2261,1,7,16,https://cdn.molhamteam.com/i/lHxWnufGNFqXpxWLP8ln_thumb_1:1.jpg,2024,title,certain,2026-04-22T09:27:35.590341+00:00
555,https://molhamteam.com/en/campaigns/555,Ramadan Relief,,"Aunt Iman migrated with her children to Arsal fleeing from the shelling and destruction, and they settled there in a small tent. Her eldest son was arrested some time ago, and they lost all their sources of income. Her second son dropped out of school to work and help with the household expenses, but unfortunately, their income is almost nonexistent, and no one lends them a hand due to the amount of debt they have. Aunt Iman's granddaughter needs medication, and the family needs our support to be able to provide for their expenses and food. Hurry to earn reward by helping them! But with your donations today to the #ReliefCampaign, you will mend the heart of our little Nur and be the light she needs.""",,150000,214632,-64632,150000,214632,-64632,2774,2,23,16,https://cdn.molhamteam.com/i/9H5P5iSLah6mLdfM4J5G_thumb_1:1.jpg,2024,publishing_date,certain,2026-04-22T09:27:35.610168+00:00
556,https://molhamteam.com/en/campaigns/556,Tamarind,,"Calling All Tamarind Lovers! Every year, we engage in the age-old debate that has puzzled mankind: tamarind or licorice? If you're a devotee of the tangy tamarind beverage, especially during the sacred month of Ramadan, join us in spreading the authentic taste of this Ramadan staple to families in northern Syria. Contribute just $5 or any amount you feel comfortable with, and together, we'll bring the delight of tamarind to households throughout the month. Let's share the joy of this traditional drink and spread goodness far and wide.",,409,409,0,409,409,0,28,0,0,0,https://cdn.molhamteam.com/i/avkQj5cPUUhXxEgfscWp_thumb_1:1.jpg,2024,publishing_date,certain,2026-04-22T09:27:35.628841+00:00
557,https://molhamteam.com/en/campaigns/557,Licorice,,"Calling All Licorice Lovers! Every year, we engage in the age-old debate that has puzzled mankind: tamarind or licorice? If you're a devotee of the tangy Licorice beverage, especially during the sacred month of Ramadan, join us in spreading the authentic taste of this Ramadan staple to families in northern Syria. Contribute just $5 or any amount you feel comfortable with, and together, we'll bring the delight of Licorice to households throughout the month. Let's share the joy of this traditional drink and spread goodness far and wide.",,225,225,0,225,225,0,12,0,0,1,https://cdn.molhamteam.com/i/ifCQXG9K5FqozZE4W5qm_thumb_1:1.jpg,2024,publishing_date,certain,2026-04-22T09:27:35.648404+00:00
558,https://molhamteam.com/en/campaigns/558,Iftar Meals - Ramadan 2024,,"Iftar Meals - Ramadan 2024
When the tranquility of the family turns into safety and comfort, its gathering in the most beloved and beautiful seasons... the days take on another meaning of happiness.
But it is a meaning that is absent from thousands. Its place is confusion and grief... for families spending their Ramadan without breaking the fast or having suhoor. In Ramadan 2024... we will strive, like every year, to provide collective iftars in northern Syria and countries of asylum and to distribute fresh baskets containing various types of vegetables and chicken, sufficient for the family for two days, as the cost of the basket is only $15. This is an opportunity for you, so do not miss its goodness!","When the tranquility of the family turns into safety and comfort, its gathering in the most beloved and beautiful seasons... the days take on another meaning of happiness. <br>But it is a meaning that is absent from thousands. Its place is confusion and grief... for families spending their Ramadan without breaking the fast or having suhoor. In Ramadan 2024... we will strive, like every year, to provide collective iftars in northern Syria and countries of asylum and to distribute fresh baskets containing various types of vegetables and chicken, sufficient for the family for two days, as the cost of the basket is only $15. This is an opportunity for you, so do not miss its goodness!",94638,94634,4,94638,94634,4,1675,0,26,13,https://cdn.molhamteam.com/i/4HVW9ANQoVghrDPyhMLj_thumb_1:1.jpg,2024,title,certain,2026-04-22T09:27:35.667167+00:00
559,https://molhamteam.com/en/campaigns/559,Ramadan Food Baskets,,"Ramadan Relief: Feed a Family in Need Join us in extending a helping hand to families in camps across northern Syria during the holy month of Ramadan. Our campaign aims to provide essential food parcels from the first night of Ramadan until its conclusion, ensuring that the most vulnerable and displaced families have sustenance throughout this sacred time. For just $65, you can support a family for an entire month, providing them with basic food items and suhoor essentials. Your contribution will make a significant difference in securing their Ramadan necessities, offering them comfort and relief during this blessed month. Make a difference today by supporting a family in need during Ramadan. Your generosity will be rewarded with immense blessings and lasting good.",,76119,76329,-210,76119,76329,-210,1066,4,8,10,https://cdn.molhamteam.com/i/8v6K3TOt5bjNdxe6VIJm_thumb_1:1.jpg,2024,publishing_date,certain,2026-04-22T09:27:35.686336+00:00
560,https://molhamteam.com/en/campaigns/560,Feed The Poor Campaign 2024,,"Feed The Poor Campaign 2024
magine empty days where families struggle to provide even a single meal for their children, their dining tables devoid of food, and their tents filled with sorrow and hardship. For displaced families in northern Syria, this has been their reality for far too long. The ""Feed the Poor"" campaign seeks to address this pressing need by providing essential meals and food parcels to these families. Your donation, no matter the amount, will make a significant difference in relieving the hunger and suffering of hundreds of families in need. Additionally, you can contribute expiation amounts for feeding the poor, ensuring that those who are most deserving receive the support they urgently require. Together, let's make a difference and bring hope to those facing hunger and hardship in northern Syria. Your generosity will bring comfort and relief to those who need it most.","magine empty days where families struggle to provide even a single meal for their children, their dining tables devoid of food, and their tents filled with sorrow and hardship. For displaced families in northern Syria, this has been their reality for far too long. The ""Feed the Poor"" campaign seeks to address this pressing need by providing essential meals and food parcels to these families. Your donation, no matter the amount, will make a significant difference in relieving the hunger and suffering of hundreds of families in need. Additionally, you can contribute expiation amounts for feeding the poor, ensuring that those who are most deserving receive the support they urgently require. Together, let's make a difference and bring hope to those facing hunger and hardship in northern Syria. Your generosity will bring comfort and relief to those who need it most.",120897,122822,-1925,120897,122822,-1925,1713,4,14,15,https://cdn.molhamteam.com/i/ajVMQrtJ4PO1wjnrOAvK_thumb_1:1.jpg,2024,title,certain,2026-04-22T09:27:35.705846+00:00
